{
  "manifestSchemaVersion": 1,
  "sqliteSchemaVersion": 2,
  "dataVersionAlgorithm": "bgmss-archive-data-version-v1",
  "dataVersion": "dv1-eddfd9cc75c0157a68adde3e42314aca8ce0e4a9f879b2c93d3218df8a43b5f7",
  "generatorVersion": "archive-contract-fixture-v1",
  "generatedAt": "2026-01-01T00:00:00Z",
  "archiveRelease": "golden-v1",
  "archiveAssetUrl": "https://github.com/bangumi/Archive/releases/download/golden-v1/archive.zip",
  "archiveAssetName": "archive.zip",
  "archiveSize": 34,
  "archiveDigest": "sha256:f77b9edef31d414daf8e90bf8a6ccdc714171bbef54997f3c695881cae1dd8b9",
  "commonCommit": "6a8442c17143a870357a5ff812362e8b5cfe9f9d",
  "commonSubjectStaffsUrl": "https://raw.githubusercontent.com/bangumi/common/6a8442c17143a870357a5ff812362e8b5cfe9f9d/subject_staffs.yml",
  "commonSize": 40,
  "commonDigest": "sha256:0649c282e74e319f810f5e9c3f2024221cef8070f24686f1bd2d041114b7eb6b",
  "schemaSqlDigest": "sha256:04fde49cb4ab9984ed20c675db850484dd2f4ec084e9ab4c219754e7033a3255",
  "catalogConfigDigest": "sha256:2b103894453b55d01bcb65b8010a55f54c57cd73e23deca39f4a0a9d2aadc678",
  "domainRulesVersion": "domain-raw-v1",
  "castRulesVersion": "cast-exact-v1",
  "sourceFiles": [
    {
      "name": "subject.jsonlines",
      "size": 32,
      "digest": "sha256:f3f48361e9a49c2fab8ac5553f88639ba322de4356b686e642c1ea459e1b7f2e",
      "recordsTotal": 8,
      "imported": 8,
      "duplicate": 0,
      "invalid": 0,
      "unresolved": 0
    },
    {
      "name": "person.jsonlines",
      "size": 31,
      "digest": "sha256:261ec97032ed6868d27318874e3f42a7db8a8490a925a0de550386a846c35495",
      "recordsTotal": 7,
      "imported": 7,
      "duplicate": 0,
      "invalid": 0,
      "unresolved": 0
    },
    {
      "name": "character.jsonlines",
      "size": 34,
      "digest": "sha256:d1b535ac220a905bdbdbb2672117a2182cff3ae0840d3b2f4088dfacc9851c8e",
      "recordsTotal": 1,
      "imported": 1,
      "duplicate": 0,
      "invalid": 0,
      "unresolved": 0
    },
    {
      "name": "subject-persons.jsonlines",
      "size": 40,
      "digest": "sha256:76b5c9ca568eae544fbb2d1efbe8ae9101938f095df8bb9d3aaeb2ee9ad0f343",
      "recordsTotal": 2,
      "imported": 1,
      "duplicate": 0,
      "invalid": 0,
      "unresolved": 1
    },
    {
      "name": "subject-characters.jsonlines",
      "size": 43,
      "digest": "sha256:c96a599bfe50bc4adb5602b98b15e2b1d19d951f2275b0352144e9f8713349a6",
      "recordsTotal": 6,
      "imported": 6,
      "duplicate": 0,
      "invalid": 0,
      "unresolved": 0
    },
    {
      "name": "person-characters.jsonlines",
      "size": 42,
      "digest": "sha256:c4f27db46fb1dbf9d486907552c324e3c3dfa7f54f077dade046055033628d60",
      "recordsTotal": 1,
      "imported": 1,
      "duplicate": 0,
      "invalid": 0,
      "unresolved": 0
    },
    {
      "name": "subject-relations.jsonlines",
      "size": 42,
      "digest": "sha256:b376934eadcd3473a6037835a7991c7fa26b6026e8580f5041902edad22b550f",
      "recordsTotal": 52,
      "imported": 52,
      "duplicate": 0,
      "invalid": 0,
      "unresolved": 0
    }
  ],
  "tableCounts": {
    "archive_meta": 1,
    "subject": 8,
    "subject_rating_bucket": 2,
    "subject_tag": 2,
    "person": 7,
    "person_career": 1,
    "character": 1,
    "subject_relation": 52,
    "staff_position": 1,
    "staff_position_category": 1,
    "staff_credit": 2,
    "cast_credit": 6,
    "staff_set": 0,
    "staff_set_member": 0,
    "catalog_position": 3,
    "catalog_position_member": 0,
    "catalog_group": 2,
    "catalog_group_member": 3,
    "catalog_capability": 15,
    "catalog_selection_rule": 3
  },
  "qualitySummary": {
    "NO_CHARACTERS": 1,
    "NO_CAST_RELATIONS": 1,
    "FILTERED_BY_VALID_CV": 1,
    "UNKNOWN_STAFF_POSITION": 1
  },
  "sqliteFile": "bangumi.sqlite",
  "sqliteSize": 237568,
  "sqliteDigest": "sha256:0c7b1982389ec3e4358b4b1ea24252dc8f707b84459b92144d9d53e6f523fc47"
}
